{
  "schema": "timestamp/v1",
  "hour": "2026-09-30T17:00:00Z",
  "subject": {
    "hour": "2026-09-30T17:00:00Z",
    "logs": {
      "audit": {
        "origin": "transparency.example/audit/v1",
        "size": 185083,
        "root": "QVti4HHuKIFjqHlWNSLSfIHLsnGeCGGtQ9nZecZQ8lE=",
        "record": "data/v1/audit/witness/2026/09/30/170007Z.json",
        "sha256": "edad2bb1c6ca65c2e26fd39df0f20b97c73dc7af26f89bc687dd56f4d6d49328"
      },
      "signs": {
        "origin": "transparency.example/signs/v1",
        "size": 9164,
        "root": "/5Ce97eWU/zg5cXVf+RX/6Hx6isx+2eR73fA0xMSFbU=",
        "record": "data/v1/signs/witness/2026/09/30/170007Z.json",
        "sha256": "c3ba1e93e8c14fd1308f35b90b872fc0f12c0e3753e6a3e30f2776465bd5ad40"
      }
    },
    "prev": {
      "record": "data/v1/timestamps/2026/09/30/16Z.json",
      "sha256": "2cc2c588c778a82e305503fcfd92a7720bca8c5e5fdc9afb40b33c65a616b9aa"
    }
  },
  "imprint": "ae8eb8ce073c8a37781898aff00966df7173875f085c20f9945f0ef9861ddad2",
  "token": {
    "provider": "example-tsa",
    "url": "https://tsa.example/tsr",
    "file": "data/v1/timestamps/2026/09/30/17Z.tsr",
    "sha256": "71f86903fc51035b93479215e4db237f281702f3cbe811935b6694e0a14a4d76",
    "genTime": "2026-09-30T17:00:10Z",
    "serial": "1007",
    "policy": "1.3.6.1.4.1.32473.1.1",
    "tsa": "CN=Example TSA (example only - not a real TSA),O=diagnos audit examples",
    "checks": [
      "status",
      "imprint",
      "nonce",
      "time",
      "signature"
    ]
  },
  "attempts": []
}
