{
  "schema": "timestamp/v1",
  "hour": "2026-09-30T15:00:00Z",
  "subject": {
    "hour": "2026-09-30T15:00:00Z",
    "logs": {
      "audit": {
        "origin": "transparency.example/audit/v1",
        "size": 184268,
        "root": "Bg4knJLtKMoa9CQhfStRpniIHNe2qhhjp3Fw8uKUqPk=",
        "record": "data/v1/audit/witness/2026/09/30/150002Z.json",
        "sha256": "4b4fbd47495e333fef1882a494b4817f11f3e77b84e2fd8e6324d6de10cf78d0"
      },
      "signs": {
        "origin": "transparency.example/signs/v1",
        "size": 9148,
        "root": "NeNTX/8TufsOzXGyoBWC8i1TfdLRTfmorvMLma1JGIE=",
        "record": "data/v1/signs/witness/2026/09/30/145503Z.json",
        "sha256": "059a7d03ba5340528d9bb7a98a96bd1ec7295a1697a420a7d96b2f0ab8ea5c79"
      }
    },
    "prev": {
      "record": "data/v1/timestamps/2026/09/30/14Z.json",
      "sha256": "daeeba3bbda0aa5449c7ad103b8ef6ef95c99d9e6d20c8e72852fd2d228e83bc"
    }
  },
  "imprint": "b3493d2117688208a9ff60d85a2fd9ad2619879dde29bf6646aa07034616012f",
  "token": {
    "provider": "example-tsa",
    "url": "https://tsa.example/tsr",
    "file": "data/v1/timestamps/2026/09/30/15Z.tsr",
    "sha256": "393d9a03ec62ea863e1ac47bc67bd6f0868c376936afc7a81a0f913c2f2e1dea",
    "genTime": "2026-09-30T15:00:05Z",
    "serial": "1005",
    "policy": "1.3.6.1.4.1.32473.1.1",
    "tsa": "CN=Example TSA (example only - not a real TSA),O=diagnos audit examples",
    "checks": [
      "status",
      "imprint",
      "nonce",
      "time",
      "signature"
    ]
  },
  "attempts": []
}
