{
  "schema": "timestamp/v1",
  "hour": "2026-09-30T19:00:00Z",
  "subject": {
    "hour": "2026-09-30T19:00:00Z",
    "logs": {
      "audit": {
        "origin": "transparency.example/audit/v1",
        "size": 185871,
        "root": "xB3wVmn1oZJ84tXGaa3cg2xjeKH8uVSEtKLzsDP5Jbo=",
        "record": "data/v1/audit/witness/2026/09/30/190006Z.json",
        "sha256": "e5eb77be99bc74db69f9f8105e12d4b278b2d09cc89a19df5f798e07a5373bf8"
      },
      "signs": {
        "origin": "transparency.example/signs/v1",
        "size": 9182,
        "root": "/a7LizJB0p6mPhpUkYITFWgJ0cvvQsTQjxqhwjchH9Y=",
        "record": "data/v1/signs/witness/2026/09/30/185502Z.json",
        "sha256": "0238ff589232815af349fb4b723d86fb9eff22f8d527a3aea29cf3091f465c2c"
      }
    },
    "prev": {
      "record": "data/v1/timestamps/2026/09/30/18Z.json",
      "sha256": "c353ffb914e68eb506f7e90683ca116782e68ac1a047b10e459629c167877baf"
    }
  },
  "imprint": "6dd429470dd5e7986bba429bdc2ab3db4c8595fe8dd1d567bd25b8c78c870d57",
  "token": {
    "provider": "example-tsa",
    "url": "https://tsa.example/tsr",
    "file": "data/v1/timestamps/2026/09/30/19Z.tsr",
    "sha256": "a337aa8b736a9c394c465bdc6f7b2fe7d648c89e51d301c258fa2b9b914b1738",
    "genTime": "2026-09-30T19:00:09Z",
    "serial": "1008",
    "policy": "1.3.6.1.4.1.32473.1.1",
    "tsa": "CN=Example TSA (example only - not a real TSA),O=diagnos audit examples",
    "checks": [
      "status",
      "imprint",
      "nonce",
      "time",
      "signature"
    ]
  },
  "attempts": []
}
