{
  "schema": "timestamp/v1",
  "hour": "2026-09-30T12:00:00Z",
  "subject": {
    "hour": "2026-09-30T12:00:00Z",
    "logs": {
      "audit": {
        "origin": "transparency.example/audit/v1",
        "size": 182781,
        "root": "JPHDJgH51ZxqGR6I04NaqfrMu6DER2N/Fv3mHMVlElk=",
        "record": "data/v1/audit/witness/2026/09/30/120002Z.json",
        "sha256": "3badd9e6df16e6e2ba5e9d5e1d0a17cc74a156e6dd100083357eaff7002f963b"
      },
      "signs": {
        "origin": "transparency.example/signs/v1",
        "size": 9128,
        "root": "mnOYxMINd/zD99KT1Ak58TqwB93RrokQ9yftnPfbMW8=",
        "record": "data/v1/signs/witness/2026/09/30/115006Z.json",
        "sha256": "4a2a7ea5d9dfd1cfa74a1c7a7d62518b527fa4ae429a5a19e5e9a5a08075dd77"
      }
    },
    "prev": {
      "record": "data/v1/timestamps/2026/09/30/11Z.json",
      "sha256": "0743a0be017965dcf20051a55d89620461f5fa9209968850ae53df9b49e473e3"
    }
  },
  "imprint": "697d876c6c486c3ea54457e9145512732f83d8256f10665fdfc99100a1fc1001",
  "token": {
    "provider": "example-tsa",
    "url": "https://tsa.example/tsr",
    "file": "data/v1/timestamps/2026/09/30/12Z.tsr",
    "sha256": "bb5b35e84a7cd178ea4ed681d1737d8ba9d462c7868582db4f8e5eb3d9355f19",
    "genTime": "2026-09-30T12:00:05Z",
    "serial": "1002",
    "policy": "1.3.6.1.4.1.32473.1.1",
    "tsa": "CN=Example TSA (example only - not a real TSA),O=diagnos audit examples",
    "checks": [
      "status",
      "imprint",
      "nonce",
      "time",
      "signature"
    ]
  },
  "attempts": []
}
